{
  "type": "fm_scenario",
  "id": "scenario.restore-expired",
  "label": "免费恢复逾期仍承担责任",
  "asOf": "2026-11-02T12:01:01Z",
  "givenInstanceRefs": [
    "instance.subscription",
    "instance.mobile-agreement",
    "instance.payment",
    "instance.mobile-request",
    "instance.mobile-result",
    "instance.discontinuation",
    "instance.refund",
    "instance.refunded"
  ],
  "steps": [
    {
      "sequence": 1,
      "actingRoleRef": "role.publisher",
      "issueInstanceRef": "instance.relaunch",
      "availableInstanceRefs": [
        "instance.subscription",
        "instance.mobile-agreement",
        "instance.payment",
        "instance.mobile-request",
        "instance.mobile-result",
        "instance.discontinuation",
        "instance.refund",
        "instance.refunded"
      ]
    },
    {
      "sequence": 2,
      "actingRoleRef": "role.reader",
      "issueInstanceRef": "instance.restore",
      "availableInstanceRefs": [
        "instance.subscription",
        "instance.mobile-agreement",
        "instance.payment",
        "instance.mobile-request",
        "instance.mobile-result",
        "instance.discontinuation",
        "instance.refund",
        "instance.refunded",
        "instance.relaunch"
      ]
    }
  ],
  "evaluations": [
    {
      "ruleRef": "rule.payment-start",
      "bindings": {
        "agreement": {
          "instanceRef": "instance.subscription"
        }
      },
      "targetInstanceRef": "instance.payment",
      "expectedResult": "2026-10-01T09:00:00Z"
    },
    {
      "ruleRef": "rule.payment-amount",
      "bindings": {
        "agreement": {
          "instanceRef": "instance.subscription"
        }
      },
      "targetInstanceRef": "instance.payment",
      "expectedResult": 9900
    },
    {
      "ruleRef": "rule.payment-deadline",
      "bindings": {
        "agreement": {
          "instanceRef": "instance.subscription"
        },
        "request": {
          "instanceRef": "instance.payment"
        }
      },
      "targetInstanceRef": "instance.payment",
      "expectedResult": "2026-10-01T09:15:00Z"
    },
    {
      "ruleRef": "rule.refund-deadline",
      "bindings": {
        "agreement": {
          "instanceRef": "instance.subscription"
        },
        "request": {
          "instanceRef": "instance.refund"
        }
      },
      "targetInstanceRef": "instance.refund",
      "expectedResult": "2026-10-23T10:01:00Z"
    },
    {
      "ruleRef": "rule.refund-amount",
      "bindings": {
        "agreement": {
          "instanceRef": "instance.subscription"
        }
      },
      "targetInstanceRef": "instance.refund",
      "expectedResult": 9900
    },
    {
      "ruleRef": "rule.restore-deadline",
      "bindings": {
        "agreement": {
          "instanceRef": "instance.subscription"
        },
        "request": {
          "instanceRef": "instance.restore"
        }
      },
      "targetInstanceRef": "instance.restore",
      "expectedResult": "2026-11-02T12:01:00Z"
    },
    {
      "ruleRef": "rule.restore-completed",
      "bindings": {
        "agreement": {
          "instanceRef": "instance.subscription"
        },
        "request": {
          "instanceRef": "instance.restore"
        },
        "refunds": {
          "instanceRefs": ["instance.refunded"]
        },
        "notices": {
          "instanceRefs": ["instance.relaunch"]
        },
        "confirmations": {
          "instanceRefs": []
        }
      },
      "expectedResult": false
    },
    {
      "ruleRef": "rule.restore-expired",
      "bindings": {
        "agreement": {
          "instanceRef": "instance.subscription"
        },
        "request": {
          "instanceRef": "instance.restore"
        },
        "refunds": {
          "instanceRefs": ["instance.refunded"]
        },
        "notices": {
          "instanceRefs": ["instance.relaunch"]
        },
        "confirmations": {
          "instanceRefs": []
        }
      },
      "expectedResult": true
    }
  ],
  "expectations": {
    "fulfillmentStatuses": [
      {
        "fulfillmentRef": "fulfillment.restore",
        "requestInstanceRef": "instance.restore",
        "status": "breached"
      }
    ]
  },
  "notes": "以固定业务时刻和独立凭证回放；仅使用当步已有且可见的证据。"
}
