{
  "type": "fm_scenario",
  "id": "scenario.short-paid",
  "label": "少付一元不能完成付款",
  "asOf": "2026-10-01T09:16:00Z",
  "givenInstanceRefs": ["instance.subscription", "instance.mobile-agreement"],
  "steps": [
    {
      "sequence": 1,
      "actingRoleRef": "role.publisher",
      "issueInstanceRef": "instance.payment",
      "availableInstanceRefs": [
        "instance.subscription",
        "instance.mobile-agreement"
      ]
    },
    {
      "sequence": 2,
      "actingRoleRef": "role.mobile-user",
      "issueInstanceRef": "instance.mobile-request",
      "availableInstanceRefs": [
        "instance.subscription",
        "instance.mobile-agreement",
        "instance.payment"
      ]
    },
    {
      "sequence": 3,
      "actingRoleRef": "role.mobile-provider",
      "issueInstanceRef": "instance.mobile-short",
      "availableInstanceRefs": [
        "instance.subscription",
        "instance.mobile-agreement",
        "instance.payment",
        "instance.mobile-request"
      ]
    }
  ],
  "evaluations": [
    {
      "ruleRef": "rule.payment-start",
      "bindings": {
        "agreement": {
          "instanceRef": "instance.subscription"
        }
      },
      "targetInstanceRef": "instance.payment",
      "expectedResult": "2026-10-01T09:00:00Z"
    },
    {
      "ruleRef": "rule.payment-amount",
      "bindings": {
        "agreement": {
          "instanceRef": "instance.subscription"
        }
      },
      "targetInstanceRef": "instance.payment",
      "expectedResult": 9900
    },
    {
      "ruleRef": "rule.payment-deadline",
      "bindings": {
        "agreement": {
          "instanceRef": "instance.subscription"
        },
        "request": {
          "instanceRef": "instance.payment"
        }
      },
      "targetInstanceRef": "instance.payment",
      "expectedResult": "2026-10-01T09:15:00Z"
    },
    {
      "ruleRef": "rule.payment-completed",
      "bindings": {
        "agreement": {
          "instanceRef": "instance.subscription"
        },
        "request": {
          "instanceRef": "instance.payment"
        },
        "proofs": {
          "instanceRefs": ["instance.mobile-short"]
        }
      },
      "expectedResult": false
    },
    {
      "ruleRef": "rule.payment-expired",
      "bindings": {
        "agreement": {
          "instanceRef": "instance.subscription"
        },
        "request": {
          "instanceRef": "instance.payment"
        },
        "proofs": {
          "instanceRefs": ["instance.mobile-short"]
        }
      },
      "expectedResult": true
    }
  ],
  "expectations": {
    "fulfillmentStatuses": [
      {
        "fulfillmentRef": "fulfillment.payment",
        "requestInstanceRef": "instance.payment",
        "status": "breached"
      }
    ]
  },
  "notes": "以固定业务时刻和独立凭证回放；仅使用当步已有且可见的证据。"
}
